{"alternatives":[],"asset_mappings":[],"audit_reasons":[],"catalyst_calendar_ids":[],"cn_hk_exposure":"unknown","fundamental_depth":"unknown","implications":["仅保留来源记录支持的有界含义。"],"indirect_indication":{"indicated":false,"reference_aliases":["e00"]},"mechanisms":["来源记录片段：nvda-20240522 0001045810 false 0001045810 2024-05-22 2024-05-22 UNITED STATES SECURITIES AND EXCHANGE COMMISSION WASHINGTON, DC 2054"],"packet_alias":"a00","price_in":{"explanation":"已保存来源记录未提供可验证的价格预期。","reference_aliases":["e00"],"status":"unclear"},"reaction_attributions":[],"reversibility":"unknown","scope":"unknown","structural_horizon":"unknown","us_next_session_exposure":"unknown","watch_points":[]}