{"alternatives":[],"asset_mappings":[],"audit_reasons":[],"catalyst_calendar_ids":[],"cn_hk_exposure":"unknown","fundamental_depth":"unknown","implications":["仅保留来源记录支持的有界含义。"],"indirect_indication":{"indicated":false,"reference_aliases":["e00"]},"mechanisms":["来源记录片段：2011-11-28 6.1048 9 2011-11-29 6.1419 9 2011-11-30 6.1528 9 2011-12-01 6.2214 9 2011-12-02 6.2445 9 2011-12-05 6.2305 9 2011-12-06 6"],"packet_alias":"a00","price_in":{"explanation":"已保存来源记录未提供可验证的价格预期。","reference_aliases":["e00"],"status":"unclear"},"reaction_attributions":[],"reversibility":"unknown","scope":"unknown","structural_horizon":"unknown","us_next_session_exposure":"unknown","watch_points":[]}