{"alternatives":[],"asset_mappings":[],"audit_reasons":[],"catalyst_calendar_ids":[],"cn_hk_exposure":"unknown","fundamental_depth":"unknown","implications":["仅保留来源记录支持的有界含义。"],"indirect_indication":{"indicated":false,"reference_aliases":["e00"]},"mechanisms":["来源记录片段：Employment Situation News Release - 2023 M13 Results Skip to Content An official website of the United States government Here is how"],"packet_alias":"a00","price_in":{"explanation":"已保存来源记录未提供可验证的价格预期。","reference_aliases":["e00"],"status":"unclear"},"reaction_attributions":[],"reversibility":"unknown","scope":"unknown","structural_horizon":"unknown","us_next_session_exposure":"unknown","watch_points":[]}