{"alternatives":[],"asset_mappings":[],"audit_reasons":[],"catalyst_calendar_ids":[],"cn_hk_exposure":"unknown","fundamental_depth":"unknown","implications":["仅保留来源记录支持的有界含义。"],"indirect_indication":{"indicated":false,"reference_aliases":["e00"]},"mechanisms":["来源记录片段：2024年8月20日全国银行间同业拆借中心受权公布贷款市场报价利率（LPR）公告_中国货币网 2024年8月20日全国银行间同业拆借中心受权公布贷款市场报价利率（LPR）公告 2024-08-20 09:00 字号大小: A A A 打印本页 中国人民银行授权全国"],"packet_alias":"a00","price_in":{"explanation":"已保存来源记录未提供可验证的价格预期。","reference_aliases":["e00"],"status":"unclear"},"reaction_attributions":[],"reversibility":"unknown","scope":"unknown","structural_horizon":"unknown","us_next_session_exposure":"unknown","watch_points":[]}